{
  "schema_version": 1,
  "id": "dev.certo.duplicate-capability",
  "version": "1.0.0",
  "host_api": { "min": "1.0.0", "max_exclusive": "2.0.0" },
  "entry": { "source": "plugin.cto", "module": "Plugin", "factory": "plugin" },
  "capabilities": [
    { "id": "storage.example", "version": "1.0.0" },
    { "id": "storage.example", "version": "1.1.0" }
  ]
}
